text,label ,notes
"For me, it is all about life experience and relationships

I developed my love of rock and metal through shared experiences with friends, going to concerts, talking about albums, buying CDs, playing them while reading liner notes, and working at the music store. Debating whether Soundgarden, Pearl Jam, or Alice in Chains was better with my friends while trying to find the next most obscure good band was basically a hobby. Ozzfest and Lolla in the 90s were rites of passage.

I developed my love of outlaw country because my dad would play it growing up, on the radio and with his guitar. I think of riding in my dad's car, and Willie Nelson pops in my head.

I developed my love of EDM when I went back to college and was hanging with people 10 years younger than me. Every road trip seemed to have Calvin Harris in the background.

When my dad got sick, I would practice songs on guitar to play and sing for him and my mom. I went back deep into country and singer/songwriter stuff I could play/sing by myself on acoustic. I'll always remember playing Jason Isbell and learning to sing Sara Bareilles a full step+ down just so I could sing it for my parents.

I backdoored into pop when one of my favorite rock bands opened for Halsey. I did a Halsey deep dive, and now Halsey is one of my top 5 favorite artists of all time. Whenever I'd find a Halsey song I'd like, I'd bring it to my wife like a kid. ""Honey, listen to this!"" She doesn't like music like I do, but sharing that with her deepened my appreciation for the music itself. Liking Halsey opened me up to explore other pop, and find other favorite artists like Lorde and Olivia Rodrigo.

K-pop felt kind of accidental, but it coincided with the K-Pop Demon Hunters release. I was on a flight back from Vegas and googled ""biggest K-pop artists"" and listened to Blackpink Essentials, and was like, holy shit, this is GOOD. I have an early 20s employee who is huge into K-pop, so now we talk about trending releases and share recommendations. It's fun af. The coolest thing about K-pop is that the release schedule is so intense that there's always something new and exciting to try as soon as you get into it. Now there are like 6 groups I really enjoy, and they're always coming out with something to keep me engaged.

At the end of all that, I can talk about any of those genres with some degree of depth. But I can't say any of it was ever deliberate- I just went where my interest pulled me.",opinion,"Shares how personal experiences, relationships, and different stages of life shaped their music taste across multiple genres."
"You are your own curator.

I know you‚Äôre thinking of curation as specialized, focused discipline. And when it comes to museum or public collections, that true. And yes, we‚Äôve bled that sense into the private sphere ‚Äî you might refer to a friend who has a well curated collection of books, music, wine, etc.

But you as the curator of your own collection get to set your own rules! You aren‚Äôt beholden to a mission statement that says you need to have a collection representing the course of musical evolution in Jamaica between 1964 and 1976. You aren‚Äôt tasked with highlighting any genre, era, country, or anything.

To make it plain: you are not building a collection for me or anyone who isn‚Äôt you. I definitely won‚Äôt like some music you like, and you definitely won‚Äôt like some music I like. That‚Äôs ok.",opinion,"Argues that people curate their own music taste naturally and should not feel pressured to fit a specific definition of a ""curated"" collection."
"
As a millenial, I feel like the limitations we grew up with was a breeding ground for curation. If you are getting your tastes from the algorithms it's a process that takes much less research and work.

Back in my day we used to have to buy songs or CDs or whatever, so we would build these much smaller collections and really listen to them (to get our money's worth).

I used to work in my college's music library and check out 5 CDs at a time and rip them into my itunes library. I would check out all kinds of music that was absolutely NOT trendy. It was fun.",opinion,Believes that older limitations in accessing music encouraged deeper exploration and more intentional music curation.
"
It‚Äôs ok that you don‚Äôt get really into specific artists. For me what happens is often this: I hear a song I like. I listen to it again and realize I don‚Äôt just like it, I REALLY like it. So I listen to the artists other popular songs and the album that song came from. Sometimes they don‚Äôt hit as well as that song did, but sometimes they do. So I listen to that album until I wear it out and then do the same to their other albums, learning things about the band or singer along the way. It‚Äôs interesting to me that some people have never experienced this. But not anything wrong with you necessarily.",opinion,Shares a personal approach to discovering artists by exploring albums after finding a song they really enjoy.
"I'm usually in a specific mood that vibes with the music I hear somewhere. I save the song name on my phone and look up the artist, cause I want to know if he makes more of what I like or find interesting. If I like 2 songs I will buy his album. Why? Because I want to understand why the artist does what he/she does. I want to get to know the artist through his music. Hits are often not the most authentic songs. I want to hear authenticity. I like weird songs that I have to listen to 5 times before they click with me. In a way I train my ears and brain to understand the artist. I also buy the albums because I want to financially support the artists. Cover arts often play a role too. In this process I find out artists and even genres that are more rewarding then others.

Good example for this is Steven Wilson and the genre ProgRock/Progmetal. In this music there are many tiny details that I can rediscover while listening over and over, because it's complex compositions, complex sounddesign and interesting rhytm patterns, effects etc.. That's why I cannot make myself listen to hiphop, autotuned pop or boring techno music.",opinion,"Describes a personal process of exploring artists through albums and values authenticity, complexity, and repeated listening."
"I don't really think there is any point in trying to curate a music taste to be a specific way. For me it all kind of just came naturally by just finding a song I like and then listening to the album it's from. If I like the album, I might check out other albums by the same artist, or I might not, maybe I'll just listen to something completely different. I think it's fine, and honestly probably even good, to have a ""fragmented"" music taste like that, since then you'll end up being exposed to so many different sounds and styles and musical traditions than you would have if you only focused on curating a specific style of music taste. For me at least the joy in listening to music comes from always trying to find sounds I've never heard before, which I suppose does lead to me having a more fragmented music taste. Honestly I'd just tell you to not worry about it too much, just listen to whatever you feel like listening to. If you want to listen to jazz today and black metal tomorrow then why not just do that?",opinion,"Believes music taste develops naturally through exploration and that having a broad, fragmented taste can be beneficial."
"Listening to full albums is a really great way to find what you like. Like- do a Bowie discography listen over the course of however much time you have. Could be months, could be a year or more. Find musicians you do like and look at their influences. If you listen to newer music, see if the song sampled or interpolated another. If you like an album, look up what genres it‚Äôs being described as, then look up albums are also described with those terms. Look up the record labels those people are under. Listen to scores of movies or video games or tv shows and look up what those musicians were inspired by (ex: I like Silent Hill‚Äôs score‚Äî they were inspired by Nine Inch Nails, Twin Peaks score , etc). Listen to the worst albums of all time, listen to random forgotten songs from the top 40 decades ago, or UK charts or charts anywhere but where you‚Äôre from. If you have a record store near you, write down some names and listen to them later (and buy if you like it). All of that is some of how I started listening to a pretty varied, but ‚ÄúMe‚Äù music, anyway",opinion,"Believes music taste develops naturally through exploration and that having a broad, fragmented taste can be beneficial."
"
I listen to a pretty wide range of music; older stuff from the 50s onwards, soul/R&B like Etta James, jazz like Billie Holiday and Ella Fitzgerald, and rock. Some artists I come back to a lot are David Bowie, The Police, Smashing Pumpkins, Nirvana, and Linkin Park. Lately I‚Äôve been getting more into jazz!

But I don‚Äôt feel grounded in any of it. I can‚Äôt really point to a favorite artist, or a specific kind of rock I like, or what actually connects the music I enjoy.

So I guess my way of listening to music would be to seek that grounding in the style of music that I like. For example, if your taste were mine, and I wanted to understand more about Nirvana, I might dig deeper into the Seattle sound that birthed them, and explore similar artists such as Mudhoney, Melvins and Green River.

For David Bowie, who has so many distinct 'periods' in his career, I would branch out and explore his collaborators and contemporaries such as T. Rex, Brian Eno, Kraftwerk, Iggy Pop etc. and in doing so, develop a better understanding of why his music was so special in the context(s) it was created.

It is fun to find the line between popular genres of music across various eras. I got really into 70's disco many years ago and it led me to collecting a huge number of obscure italo disco and electro-funk records. Some acts like Daft Punk wear their influences on their sleeves and can bring you into a whole world of international pop music you were previously unfamiliar with.

I'm not sure if this really addresses your question as I don't think I consciously ""curate"" my taste to appear coherent, I am simply genuinely interested in the influences that shape the music I like and it leads to me discovering so many deeper musical cuts.",opinion,"Suggests exploring related artists, influences, and musical movements to gain a deeper understanding of the music you enjoy."
"I think it's a combination of them both. Personally, my taste in music has shifted, expanded and evolved over the years. I love genres of music now that I didn't care about 10+ years ago; my taste in music just developed upon being exposed to different sounds and just naturally gravitating towards them the more I heard. Sometimes our ears do require an adjustment period before we can actually come around to loving something.

My music library is all over the place in between garage rock, drum and bass, trance, reggaeton, jazz, heavy metal, R&B, Celtic, film score, synthpop, etc. Some genres I gravitated towards naturally and others I did have to become accustomed to the sound to the point where I now do love it. For how sporadic my library is, it's definitely intentional and of a solid interest as it's full of full-length albums. I don't listen to or make playlists. The closest I get to that is listening to compilations or film/television soundtracks. Not only do I love the genres, but I love individual artists in each.",opinion,"Believes music taste develops through both natural exposure and intentional exploration, evolving over time as people encounter new genres and artists."
"
You really have to put the effort into it in order to really understand one particular artist. If you just know their biggest hits, you are getting only 10% of the big picture. It's like an iceberg. The top of the iceberg is what the radio plays or what friends will recommend, but the majority of the iceberg is what you will discover when you dive deep and listen to every album by a specific artist. Obviously this is not easy to do for most people because it's quite time consuming. I actually just made a post about this yesterday in here.

As for me personally, I'm in my 50's so I've definitely had the time to deep dive into artists that I want to get to know better, however most of my life I pretty much only knew what was on the radio and what me and my friends listened to. So it's a combination of it happening naturally and me taking control over what my music taste is. The more music you hear, the more you will be drawn to a certain type unless you're the kind of person that really is scattered and can like almost anything with no obvious preferences.",opinion,Believes that understanding an artist requires deep exploration beyond their popular songs and that music taste develops through both experience and intentional effort.
"Offhand, I'd have to say deliberate listening. Listening to an album, or building specific playlists and listening to them. If one is primarily listening to an algorithm-driven source, there may be a detachment because you're not really investing anything into the act of listening. This would have held true for people who primarily listened to the radio, but even in the old days of actual DJs choosing the playlist, there would still be intent behind it (versus now where the primary goal isn't musical interest, but market dominance). You even use the word yourself, ""intentional and coherent"", if you're just clicking an icon on a screen because you like a song, that's a pretty surface-level engagement.",opinion,"Argues that intentional listening, such as exploring albums and creating playlists, leads to a deeper connection with music than algorithm-driven listening."
"What do you think it would mean to feel ‚Äúgrounded‚Äù? There are people whose personalities seem sort of predicated on a rather narrow taste in musical genres- we all know people who only listen to country or hip hop and consider it a cultural marker. But I presume you‚Äôre not talking about that. Most people who enjoy music for what it is tend to have fairly porous tastes, where the more you listen to what you like, the more interested you become in adjacent and related genres. You might be ‚Äúgrounded‚Äù in what you listened to early in life, or songs or artists you associate with exciting or difficult or memorable times in your life. Such associations are sometimes unbreakable, and give the music significance beyond its content or themes. But I presume you already understand those things, and I‚Äôm not sure what else you might be referring to.",question,"Asks what it means to feel ""grounded"" in music taste and explores how personal experiences shape musical preferences."
"Prioritizing listening to whole albums is a good start, but also you're allowed to enjoy music how you want. If it doesn't come to you naturally, then it's always gonna come across as forced. Mind you there's already enough pretentious asshats in online music communities trying to one up each other with how profound, refined, and diverse their taste is. Being on reddit you only get to see the most obsessive and nerdy representatives of every hobby and you might get the impression you have to be like that to be a true fan. I enjoy movies, but I'm not a cinephile. I enjoy coffee, but I'm not a nerd about it. Being just kinda into things is okay and pretty cool, actually.",opinion,Believes people should enjoy music in their own way and not feel pressured to develop highly curated or obsessive music tastes.
"Listen and follow your instincts. You will find you go through various phases. At least I have.

A few summers ago, I couldn't get enough of both dark wave and reggae/dub.

This year its mostly jazz fusion, jazz funk and ambient.

I still have old favorites, of course, but those are my enthusiasms right now. One process that's been helpful to me is I add any album I hear about that I might want to explore to my Amazon Music account. At this point, I have over 20,000 songs. When I don't know what to listen to, I click on all songs and play that on shuffle. When something really catches my ear, then I explore that artist in more depth.",opinion,Encourages following personal interests in music and describes how musical preferences can change over time through exploration.
"For starters, buy physical copies of music you like. Use services to test listen, but at some point, support the artists. Making the investment will lead to a stronger connection. Also, you own it forever. I can draw a line from Bechet to Lightening Hopkins to The Sonics to The Butthole Surfers to Six Fingered Satellite because I own and understand all that music. If I had just heard a song or two in passing, I would not be able to make the same connections.

Also, owning full albums will help you learn what you don‚Äôt like. What you don‚Äôt like is as important as what you do. I can talk about a band like the Zombies by saying they‚Äôre a Merseybeat / psyche crossover band, but they‚Äôre not as cheesy as most. I love me some Merseybeat, but man a lot of it was horribly written. So when you come across a band who avoids the trappings that turn you off, you recognize the value.",opinion,Argues that owning full albums and supporting artists helps build a deeper understanding of music and personal taste.
"I think it's to do with physical media v streaming. Although I use streaming to check out new (and new to me) stuff, my listening for pleasure is vinyl. My vinyl listening is curated in the sense that I'd rather listen to a second choice album by a band I like than that one album I like from a band that most of the time I don't like. I also consciously think about my taste, and what connects the music I like. For example, I like conversational lyrics, so explore that and see where it takes me. I think this goes back to the days when your record collection was a public statement of your taste. Even if no one is flicking through my records, I still keep something of that old idea. The other thing about physical media is you're more invested in it, you listen to something several times because you own it, and the more you listen to it the more it grows on you. To some extent you're choosing what you want to like, rather than stumbling upon random albums this way and that.",opinion,Believes physical media encourages more intentional listening and helps people develop a clearer understanding of their music taste.
Way back when they had a social media platform called my space. I remember meeting a girl on my space who listened to pagan rock . I asked what about speed metal ? She said - just pegan rock . I said no punk ? Art damage ? Industrial? She says no - just pegan rock,opinion,Shares an anecdote about someone whose music taste was focused almost entirely on a single genre.
My theory is that people that identify closely with a particular kind of music came into contact with that particular sound at either a crucial time of their lives. That crucial time could be anything from a coming of age awareness moment as a kid or some moment of first tasted freedom. It could be a traumatic or intense context and the music eased the suffering in a way. Music is the soundtrack to our existence. We are curated by the events of life. The soundtrack to those particular moments become touchstone sounds. Of course there are other reasons and paths to particularity. The main thing is to enjoy it.,opinion,Suggests that strong music preferences are often shaped by important life experiences and emotional connections.
"Tips and tricks to building playlists?
I got hella songs and listen to a lot of rap, R&B, alternative, melodic stuff, but when it comes to actually making playlists I kinda struggle. Not with finding songs, more with making the playlist feel like it has a theme or vibe instead of just being a bunch of songs thrown together.

What are some of your favorite playlist themes or concepts you‚Äôve made? Could be something broad enough for 100+ songs or something super specific
Let me know what your guys process is",question,"Asking for advice on creating playlists with a clear theme, mood, or overall vibe."
"I don't really do playlists for personal use. If I'm not listening to an album, I'll just pick the next song I want to hear as the current one is playing. Is playlist culture a generational thing? A genre thing?",question,"Asking whether playlist culture is influenced by generation, genre, or personal listening habits."
"My method for a while has been just shuffling a big playlist.
I‚Äôll usually play the song I really want to hear in the moment and just skip the ones I don‚Äôt want to hear often that
I want to organize my music so I don‚Äôt have to do that often I have 2 playlist already one with love songs and one that give confidence now the topics are more specific then just that but when I want to feel that way I automatically have them there and I‚Äôll play the song I want to",opinion,Shares a personal method for organizing music using playlists based on moods and frequently listening to a large shuffled playlist.
"I make mostly concept playlists (like a concept album). One of my favorites is titled ""this house is haunted"" and it's all songs about unpleasant things either taking place in a house or using a house as a metaphor.

I make loads of temp playlists. If I hear a song and think it would be interesting played next to a different song, I make a playlist. If I think a song would be interesting in a playlist but not sure exactly how, I add it to my ""songs for future playlists"". If I have an idea for a playlist, I'll make one before I even know what songs I'm gonna add (currently working on a zodiac playlist where there's one song for each sign). I have many ongoing playlist ideas, some of which will probably go nowhere and get deleted eventually.",opinion,"Describes a personal approach to playlist creation using themes, concepts, and experimental song combinations."
"honestly biggest thing that helped me was stop trying to make every playlist ""mood coherent"" and just pick one specific scenario, like ""driving home at 1am"" instead of ""chill vibes."" way easier to know what fits and what doesn't when it's that specific

also order matters more than ppl think, i don't just dump songs in randomly, i ease in, build up, then taper off at the end so it feels like it goes somewhere instead of just shuffling

for the big 100+ song ones i'm pretty loose on genre as long as the energy matches, for the tiny specific ones i'm way more ruthless about kicking stuff out even if i like the song

also just go back and prune old playlists every once in a while, stuff you added during a phase doesn't always hold up with the rest",opinion,"Recommends building playlists around specific situations, carefully ordering songs, and regularly removing tracks that no longer fiit."
"I use the Smarter Playlists app (Spotify plugin) that allows me to take the standard Spotify playlists and combine them/augment them as required.

I run these once a month to generate new playlists each month. I keep an archive list (as part of the process) against which to compare to ensure that there are no previously included songs in the new playlists.

If I hear songs I like I add them to new playlists. The monthly generated ones are discarded once I've listened to them (although the archive file remains for future use).

Edit: in terms of your issue about not just throwing songs together, you can also do the above by picking particular genres/playlists for your playlist sources and the app allows you to sample from these based on pretty detailed parameters (I'm sure, for example, bpm can be used but I have not tried this).",opinion,Shares a method for generating and organizing playlists using Spotify tools and personalized filtering rules.
"I go to a lot of live shows and I make playlists out of the set lists from my favorite performances. I also choose one song from every performer I see over the year and put those into a playlist.

Before I was streaming music and was managing my library on a desktop computer I added tags with random information about where they‚Äôre from, what language, etc. Then I‚Äôd make smart playlists that would automatically pull from my library so I would do a playlist from a single country, state, city, songs in Spanish, stuff like that.",opinion,"Describes personal playlist-building methods based on live concerts, locations, languages, and music library tags."
"I usually theme my playlists to a vibe based on production. Then always choose the opening track to be something I would genuinely replay the most. Sometimes I curate them to flow together well but that takes a lot of time.

To find similar songs of the same vibe for a playlist, for Spotify specifically I like the recommended songs section under the playlist as you‚Äôre constructing it. Then the song radios and artist radios now have the non-personalized feature which works sometimes. I‚Äôve discovered tons of songs artists through those!",opinion,"Shares a playlist-building strategy based on production style, song flow, and discovering similar tracks through Spotify recommendations."
